{
  "id": "色",
  "text": { "Hans": "色", "Hant": "色" },
  "readings": { "pinyin": "sè" },
  "meaning": { "en": "color", "zh-Hans": "颜色", "zh-Hant": "顏色" },
  "fact": {
    "en": "色 first showed a hand pressing down on a kneeling person. Later it was borrowed for its sound to write the word 'color'.",
    "zh-Hans": "“色”原本画的是一只手按住一个跪着的人。后来它因为读音被借来表示“颜色”。",
    "zh-Hant": "「色」原本畫的是一隻手按住一個跪著的人。後來它因為讀音被借來表示「顏色」。"
  },
  "story": {
    "topic": { "en": "The Color-Changing Chameleon", "zh-Hans": "会变色的变色龙", "zh-Hant": "會變色的變色龍" },
    "hook": {
      "en": "Look closely! The little chameleon on the branch changes from green to brown to orange.",
      "zh-Hans": "仔细看！树枝上的小变色龙，从绿色变成棕色，又变成了橙色。",
      "zh-Hant": "仔細看！樹枝上的小變色龍，從綠色變成棕色，又變成了橘色。"
    },
    "early": {
      "en": "The top part, 爪, is a hand; the bottom part, 卩, is a kneeling person. The bottom has nothing to do with 巴!",
      "zh-Hans": "上面的“爪”是手，下面的“卩”是一个跪着的人。下面这部分和“巴”可没有关系！",
      "zh-Hant": "上面的「爪」是手，下面的「卩」是一個跪著的人。下面這部分和「巴」可沒有關係！"
    },
    "turn": {
      "en": "Surprise: 色 was once an old form of 印, and both meant 'to press down'.",
      "zh-Hans": "想不到吧：“色”曾经是“印”的古老写法，它们原来都是“往下按”的意思。",
      "zh-Hant": "想不到吧：「色」曾經是「印」的古老寫法，它們原來都是「往下按」的意思。"
    },
    "closer": {
      "en": "From a hand pressing down to every color a chameleon can show: that's 色, color!",
      "zh-Hans": "从一只往下按的手，到变色龙身上的各种颜色，这就是颜色的“色”！",
      "zh-Hant": "從一隻往下按的手，到變色龍身上的各種顏色，這就是顏色的「色」！"
    }
  },
  "journey": "default",
  "origin": { "type": "loan" },
  "status": "draft",
  "sources": [ { "title": "Wiktionary: 色", "url": "https://en.wiktionary.org/wiki/%E8%89%B2" } ]
}
